{
  "id": "MB-AIM-SORT",
  "version": "0.1",
  "title": "Sort barrels by colour with VEX AIM",
  "domain": "vex-aim",
  "description": "Collect six barrels (three orange, three blue, as included with the VEX AIM kit) and deliver each to the zone of its own colour at either end of a 1.83 m x 1.22 m (6 ft x 4 ft) arena, within 45 seconds. Scored on the final world state: a barrel counts only if its centre rests inside the zone of its colour. The arena is MotionBench-defined, not an official VEX field.",
  "arena": {
    "width_m": 1.8288,
    "height_m": 1.2192,
    "obstacles": [],
    "zones": {
      "orange": { "x": 0.0, "y": 0.3596, "w": 0.30, "h": 0.50, "label": "orange-zone" },
      "blue": { "x": 1.5288, "y": 0.3596, "w": 0.30, "h": 0.50, "label": "blue-zone" }
    }
  },
  "robot": { "radius_m": 0.04 },
  "budget": { "time_s": 45 },
  "goal": { "kind": "delivery" },
  "reference": { "floor": 0 },
  "layouts": {
    "dev-01": {
      "start": { "x": 0.9144, "y": 0.12, "theta": 1.5708 },
      "objects": [
        { "id": "o1", "x": 1.30, "y": 0.25, "zone": "orange", "kind": "barrel-orange" },
        { "id": "o2", "x": 0.60, "y": 0.95, "zone": "orange", "kind": "barrel-orange" },
        { "id": "o3", "x": 1.15, "y": 0.70, "zone": "orange", "kind": "barrel-orange" },
        { "id": "b1", "x": 0.55, "y": 0.30, "zone": "blue", "kind": "barrel-blue" },
        { "id": "b2", "x": 1.05, "y": 1.05, "zone": "blue", "kind": "barrel-blue" },
        { "id": "b3", "x": 0.75, "y": 0.62, "zone": "blue", "kind": "barrel-blue" }
      ]
    },
    "dev-02": {
      "start": { "x": 0.9144, "y": 1.10, "theta": -1.5708 },
      "objects": [
        { "id": "o1", "x": 1.40, "y": 0.95, "zone": "orange", "kind": "barrel-orange" },
        { "id": "o2", "x": 0.95, "y": 0.35, "zone": "orange", "kind": "barrel-orange" },
        { "id": "o3", "x": 1.25, "y": 0.20, "zone": "orange", "kind": "barrel-orange" },
        { "id": "b1", "x": 0.45, "y": 1.00, "zone": "blue", "kind": "barrel-blue" },
        { "id": "b2", "x": 0.70, "y": 0.25, "zone": "blue", "kind": "barrel-blue" },
        { "id": "b3", "x": 0.60, "y": 0.70, "zone": "blue", "kind": "barrel-blue" }
      ]
    }
  }
}
